,Unnamed: 0.1,Title,Genre,Summary,Year,Rating,Metascore,Votes,Runtime,Actors
369,369,the 100,drama mysteri scifi,set ninetyseven year after a nuclear war ha destroy civil when a spaceship hous human lone survivor send one hundr juvenil delinqu back to earth in hope of possibl repopul the planetset ninetyseven year after a nuclear war ha destroy civil when a spaceship hous human lone survivor send one hundr juvenil delinqu back to earth in hope of possibl repopul the planet the seri is set year after a devast nuclear war wipe out almost all life on earth the onli known survivor are the resid of twelv space station in earth orbit prior to the war the space station band togeth to form a singl massiv station name the ark weni galor about peopl live resourc are scarc and all crime no matter their natur or sever are punish by death float unless the perpetr is under year of age after the ark life support system are found to be critic fail one hundr juvenil prison are declar expend and sent to the surfac in a last ditch attempt to determin if earth is habit again the teen arriv on a beauti planet theyv onli seen from space confront the danger of thi rug new world they struggl to form a tent commun howev they discov that not all human wa wipe out there are peopl on earth who surviv the war call grounder by the the ark consist of the space station previous repres the nation of the uk usa australia canada china japan india russia venezuela franc brazil and uganda after the earth wa destroy by a nuclear war the remain peopl put togeth a giant space station call the ark into space to surviv then after year of live in space the counsel send the juvenil prison down to earth onc they arriv they are quick to set a no law system of govern the realiz they are not the onli one on earth and they quickli adapt to their new home year after a devast nuclear war wipe out almost all life on earth humankind is live in space resid in twelv space station the space station band togeth to form a singl massiv station name the ark where about peopl live resourc are scarc and all crime no matter their natur or sever are punish by death float unless the perpetr is under year of age after the ark life support system are found to be critic fail one hundr juvenil prison are declar expend and sent to the surfac in a last ditch attempt to determin if earth is habit again the teen arriv on a beauti planet theyv onli seen from space confront the danger of thi rug new world they struggl to form a tent commun howev they discov that not all human wa wipe out there are peopl on earth who surviv the war call grounder by the the teen quickli discov they are not welcom by the hostil grounder and must band togeth in order to surviv set year after a nuclear apocalyps onboard a die space station run out of air juvenil delinqu are sent back to earth to see if it is habit on the ground they will be test by the earth the secret it hide and most of all themselv set year after a nuclear war destroy the earth the last human live in space station which have band togeth to creat the ark in the ark everi crime no matter the reason for it or it sever is punish by death float but the ark life support is fail and teen who commit crime are declar expend and are sent to earth to find out if it is habit they are sent with wristband that monitor their health and send it to the ark the quickli develop a no law rule on earth but while in search for food the teen discov they are not alon there are other human on earth as well as mutat anim ninetyseven year ago nuclear armageddon decim planet earth destroy civil the onli survivor were the inhabit of intern space station that were in orbit at the time three gener have been born in space the survivor now number and resourc are run out on their die ark the station now link togeth and repurpos to keep the survivor aliv draconian measur includ capit punish and popul control are the order of the day as the leader of the ark take ruthless step to ensur their futur includ secretli exil a group of juvenil prison to the earth surfac to test whether it habit,2014,7.7,,171597.0,43,"Eliza Taylor, Bob Morley, Marie Avgeropoulos, Isaiah Washington"
370,370,tyrant,action drama thriller,an unassum american famili is drawn into the work of a turbul middl eastern nationan unassum american famili is drawn into the work of a turbul middl eastern nation barri alfaye ha been live in the unit state for twenti year dure which time he got marri to molli olson and had two children sammi and emma with both molli and he work as physician barri as a pediatrician in pasadena thi life beli the fact that at age sixteen he under hi given name bassam escap hi famili life in the middl eastern countri of abuddin where the alfaye have been the dictatori ruler for gener normal of violent and repress regim which he could not moral toler he ha not been back to abuddin sinc on the urg of hi mother barri decid to go back to abuddin with molli and famili in tow he may find that leav abuddin thi second time around is more difficult as he get ensconc in the troubl the alfaye are face in gener in continu to rule the countri as a repress dictatorship the longer barri stay the more it in turn affect the onli life of democrat freedom molli sammi and emma have known up to thi point bassam alfaye or barri as he is known to hi wife molli and two children sammi and emmaha been live a self impos exil from hi middl eastern countri call abbudin for year although he is the second son of the rule presid bassam ha no desir to go back home howev he is compel to attend hi nephew wed togeth with hi famili on the urg of hi mother the rule dynasti ha been recent plagu by opposit and civilian revolt so when barri father unexpectedli die barri must remain home to advic and support jamal hi brother and the new presid in order to prevent the countri from plung into war the seri start with bassam the son of a dictat of abbudin come home after a long persuationh come to hi nephew wed ahm when he come worst happen hi father die hi brother is almost kill which forc him and hi famili to stay though he had been for exil for twenti year he did not like hi father regim sinc they mistreat peopl situat forc bassam hi wife emma and hi two children to stay in abbudin jamal take over after hi father death and bassam stay as hi personn advic,"2014, 2016",7.8,,21167.0,60,"Adam Rayner, Jennifer Finnigan, Ashraf Barhom, Moran Atias"
371,371,devious maids,comedi drama mysteri,four latina maid with ambit and dream of their own work for the rich and famou in beverli hillsfour latina maid with ambit and dream of their own work for the rich and famou in beverli hill,"2013, 2016",7.8,,20380.0,60,"Ana Ortiz, Dania Ramirez, Roselyn Sanchez, Judy Reyes"
372,372,once upon a time,adventur fantasi romanc,a young woman with a troubl past is drawn to a small town in main where fairi tale are to be believeda fade televis actor and hi stunt doubl strive to achiev fame and success in the film industri dure the final year of hollywood golden age in lo angel,2019,,,,,"Quentin Tarantino, Margot Robbie, Timothy Olyphant, Brad Pitt, Leonardo DiCaprio"
373,373,scandal,drama thriller,a former white hous commun director start her own crisi manag firm onli to realiz her client are not the onli one with secretsa former white hous commun director start her own crisi manag firm onli to realiz her client are not the onli one with secret when you get into troubl there onli one person to call olivia pope olivia is a profession fixer who make problem go away befor anyon even know they exist for the money the power and even the presid olivia is a legend in her field her spectacular success is mostli due to her unbreak rule of alway trust your gut no matter how care you are when you do damag control for a live your bound to caus some damag to your own life she and her crew eat sleep live and breath crisi each week as the team race against the clock to defus intrigu new problem befor they becom fullblown disast they also have to deal with their own person issu they may call themselv gladiat in suit but littl by littl olivia and her crew begin to reveal the chink in their armor,"2012, 2018",7.8,,63326.0,43,"Kerry Washington, Darby Stanchfield, Katie Lowes, Guillermo Díaz"
374,374,grimm,drama fantasi horror,a homicid detect discov he is a descend of hunter who fight supernatur forcesa homicid detect discov he is a descend of hunter who fight supernatur forc portland detect nick burkhardt ha seen some gruesom crime scene but noth prepar him for the strang vision he begin see seemingli regular peopl momentarili transform into hideou monster a visit from hi onli live rel reveal the truth nick ha inherit the abil to see supernatur creatur and as a grimm he is task with keep the balanc between mankind and the mytholog a reform big bad wolf becom hi greatest and also reluct alli and confid it not long befor hi work as a policeman lead nick to the crimin he onc thought were onli found in fairi tale portland pd detect nick burkhartd realis he is a grimm and can see supernatur creatur as no one can togeth with hi polic badg and grimm archiv sent down by hi ancestor from around the world at differ time he set out to rid the citi of portland of it most horrif villain he is assist by detect harmon friend monro and hi gf with occasion help from guest as the stori progress,"2011, 2017",7.8,,101557.0,45,"David Giuntoli, Russell Hornsby, Silas Weir Mitchell, Sasha Roiz"
375,375,portlandia,comedi,a sketchcomedi seri that parodi life in portland oregona sketchcomedi seri that parodi life in portland oregon,"2011, 2018",7.8,,16349.0,22,"Fred Armisen, Carrie Brownstein, Kyle MacLachlan, Sam Adams"
376,376,switched at birth,drama famili romanc,two teenag girl live are turn upsid down when they find out they were switch at birthtwo teenag girl live are turn upsid down when they find out they were switch at birth tell the stori of two teen girl who discov that they were accident switch at birth bay kennish grew up in a wealthi famili with two parent and a brother while daphn vasquez who lost her hear as a child due to a case of mening grew up with a singl mother in a poor neighborhood thing come to a dramat head when both famili meet and struggl to learn how to live togeth for the sake of the girl,"2011, 2017",7.8,,21562.0,60,"Katie Leclerc, Vanessa Marano, Constance Marie, D.W. Moffett"
377,377,wilfred,comedi drama mysteri,the stori of a depress man who inexplic is the onli one who can see hi neighbor dog as a full grown man in a dog suitth stori of a depress man who inexplic is the onli one who can see hi neighbor dog as a full grown man in a dog suit the stori of ryan a depress man who believ he is get nowher in hi life and plan to kill himself in the middl of hi attempt suicid he is ask to watch hi neighbor dog wilfr but ryan can onli see wilfr as a real person instead of an anim that everyon els see as they begin to bond more and becom friend wilfr teach ryan a life lesson about peopl love and live,"2011, 2014",7.8,,38499.0,22,"Elijah Wood, Jason Gann, Fiona Gubelmann, Dorian Brown Pham"
378,378,human target,action adventur crime,an uniqu bodyguard protect hi client by secretli infiltr their live in order to draw out and elimin threatsan uniqu bodyguard protect hi client by secretli infiltr their live in order to draw out and elimin threat christoph chanc is a highli discreet problem solver special in desper caus he work with retir polic detect winston who act mainli as backoffic and guerrero a scari comput wizard and former gangster christoph is and need to be a fearless unbeat commando as well as handi and clever as macgyv assum all kind of ident from bodyguard to monk and from lawyer to sport profession,"2010, 2011",7.8,,16567.0,60,"Mark Valley, Chi McBride, Jackie Earle Haley, Indira Varma"
379,379,reaper,adventur comedi drama,on hi st birthday sam discov hi parent sold hi soul to the devil befor birth and he must now be a bounti hunter for the devil until he dieson hi st birthday sam discov hi parent sold hi soul to the devil befor birth and he must now be a bounti hunter for the devil until he die,"2007, 2009",7.8,,22291.0,45,"Bret Harrison, Tyler Labine, Rick Gonzalez, Missy Peregrym"
380,380,my name is earl,comedi,a neer do well win in the lotteri and decid to right all the wrong from hi past with hi newfound realizationa neer do well win in the lotteri and decid to right all the wrong from hi past with hi newfound realiz earl is a lowlif who buy a win lotteri ticket onli to get hit by a car lose the ticket in the process he then realiz in the hospit that hi bad luck is the result of karma in which fate punish him for all the rotten thing he ever done in hi life therefor he then decid to dedic hi life to make amend to all the peopl he ha hurt in hi life earl hickey wa the kind of guy who did bad thing and had a bad life after hed won on a scratch card he got hit by a car while jump for joy and lost it too hi hospit tv told him about karma how if you do good thing good thing will happen thi gave earl an epiphani that turn hi life and luck around he decid to list all the bad thing that hed done in hi life and onebyon hed make up for it thi hit us comedi with a hilari cast of color charact show us the bumpi journey earl take to improv hi life earl hickey a complet low life but chang how he live becaus of a win lotteri ticket instead of steal and mooch off everyon he decid karma must choos hi fate also he decid he go to make up for everi thing bad he ever done earl hickey is a neer do well without a job or a direct in life instead he spend hi day drink beer steal whatev isnt bolt down and be a leech on societi but when he win the lotteri of a lifetim earl think hi luck may have just changeduntil he hit by a car as he recov in a hospit bed earl realiz that mayb the reason whi he there is becaus of a simpl five letter word karma for everi rotten thing he done a rotten thing come right back to him and the onli way he can stop that is to make good for everi bad deed have compil a lengthi list of thing he done to peopl earl set out to right all the wrong from hi past all of thi on the promis that mayb he can enjoy hi fortun onc and for all but onli if he can finish the list first aid him is hi lifelong best friend and brother randi and an ensembl of charact to assist observ amus berat or are just there for earl hickey,"2005, 2009",7.8,,90868.0,22,"Jason Lee, Ethan Suplee, Jaime Pressly, Nadine Velazquez"
381,381,robot chicken,anim action comedi,pop cultur refer fli thick and fast as stopmot anim is featur in sketch lampoon everyth from televis movi to comic bookspop cultur refer fli thick and fast as stopmot anim is featur in sketch lampoon everyth from televis movi to comic book,2005,7.8,,37181.0,11,"Seth Green, Matthew Senreich, Breckin Meyer, Tom Root"
382,382,ncis,action crime drama,the case of the naval crimin investig servic washington dc major case respons team led by special agent leroy jethro gibbsth case of the naval crimin investig servic washington dc major case respons team led by special agent leroy jethro gibb special agent leroy jethro gibb is the leader of a team of special agent belong to the nci naval crimin investig servic major case respons team gibb a former marin is a tough investig and a highli skill interrog who reli on hi gut instinct as much as evid gibb second in command is senior field agent toni dinozzo a woman moviequot former baltimor homicid detect who despit be the class clown alway get the job done the team also consist of probationari field agent eleanor bisbop a former nsa agent as well as junior field agent timothi mcgee a computersavvi agent often mock by dinozzo assist them are abbi sciuto the energeticbutgoth lab tech who is like a daughter to gibb and is famous quot as say mike hunt wont stop bleed and dr donald mallard nicknam ducki the eccentr medic examin full of unusu stori thi team of elit agent base in washington dc solv crimin case involv marin and navi personnel and their famili sometim travel the unit state or the world to do it,2003,7.8,,106466.0,60,"Mark Harmon, David McCallum, Sean Murray, Pauley Perrette"
383,383,star wars: clone wars,anim action adventur,the event and battl of the galact republ last major war are recountedyoda mace windu obiwan kenobi anakin skywalk and other jedi knight lead the grand armi of the republ against the droid armi of the separatist chronicl the event that took place between star war episod ii attack of the clone and star war episod iii reveng of the sith the clone war follow the wartim day of anakin skywalk obiwan kenobi and yoda the clone war bridg the gap between the origin and prequel trilog of the star war saga and bring new charact to the forefront of star war canon includ anakin apprentic ahsoka tano and captain rex,"2008, 2020",8.1,,39243.0,23,"Tom Kane, Matt Lanter, Dee Bradley Baker, James Arnold Taylor"
384,384,teen titans,anim action adventur,a team of five teenag superhero save the world from mani villain around their citi while experienc thing normal teen face todaya villain maniac plan for world domin sidetrack five teenag superhero who dream of hollywood stardom it seem to the teen that all the major superhero out there are star in their own movieseveryon but the teen titan that is but de facto leader robin is determin to remedi the situat and be seen as a star instead of a sidekick if onli they could get the hottest hollywood film director to notic them with a few madcap idea and a song in their heart the teen titan head to tinsel town certain to pull off their dream but when the group is radic misdirect by a serious super villain and hi maniac plan to take over the earth thing realli go awri the team find their friendship and their fight spirit fail put the veri fate of the teen titan themselv on the line when hollywood start make blockbust movi about all of their superp the teen titan realiz that the world doesnt consid them real hero worthi of grace the big screen robin scott menvil cyborg khari payton beast boy greg cipe raven tara strong and starfir hynden walch decid to prove themselv by take on super villain slade direct by hubertu hoffmann featur the voic of will arnett kristen bell stan lee patton oswalt wil wheaton nicola cage lil yachti and halsey direct by aaron horvath and peter rida michail in jump citi the teen titan arriv to stop the balloon man when he cannot figur out who they are the teen titan jump into a rap song to introduc themselv and becom distract forc the justic leagu to interven they critic the titan for be childish not take anyth serious and bring up the fact that they do not have a movi of their own to prove their legitimaci while at the premier of batman again after raven sent the challeng of the unknown to anoth dimens robin humili himself after assum that there will be a movi about him and is laugh out by the audienc at the rest of the team suggest robin resolv that in order to get a movi made about him and the titan they need an archnemesi,2018,6.8,69.0,11714.0,84,"Aaron Horvath, Peter Rida Michail, Greg Cipes, Scott Menville, Khary Payton, Tara Strong"
385,385,3rd rock from the sun,comedi famili scifi,a group of alien are sent to earth disguis as a human famili to experi and report life on the rd planet from the suna group of alien are sent to earth disguis as a human famili to experi and report life on the rd planet from the sun a group of alien ha come to earth to learn about it popul custom etc to avoid detect they have taken on human form which give them human emot physic need etc without the understand of what they mean or the inhibit normal present in human their leader take the posit of a colleg professor their militari expert as hi sister their intellig expert supposedli oldest of group take form of hi teenag son the uninhibit reaction turn everyday event into unusu situat the high command of an alien expedit land on earth what he consid to be the leastimport planet in human form as dick solomon along for the ride are hi alien compatriot harri salli and tommi who is the eldest of the group but is now angrili trap in a teen bodi,"1996, 2001",7.8,,43144.0,60,"John Lithgow, Jane Curtin, Kristen Johnston, French Stewart"
386,386,the outer limits,drama fantasi horror,a modern reviv of the classic scienc fiction horror antholog show the outer limit episod often have twistend and involv alien sometim a stori from one episod continu in a later episodean antholog seri of insight scienc fiction tale antholog type scienc fiction program with a differ cast each week tend toward the hard scienc space travel time travel and human evolut it tri to examin in each show some form of the question what is the natur of man,"1963, 1965",8.2,,6194.0,51,"Bob Johnson, Ben Wright, William Douglas, Robert Culp"
387,387,the munsters,comedi famili fantasi,a famili of friendli monster have misadventur never quit understand whi peopl react to them so strangelya famili of friendli monster have misadventur never quit understand whi peopl react to them so strang the munster are a weird but honest famili herman the father is frankenstein monster lili hi wife and grandpa her father are vampir eddi their littl son is a werewolf marilyn their niec is the onli normal one that is the ugli duck of the famili,"1964, 1966",7.8,,10488.0,30,"Fred Gwynne, Al Lewis, Yvonne De Carlo, Butch Patrick"
388,388,castle rock,drama fantasi horror,base on the stori of stephen king the seri will intertwin charact and theme from the fiction town of castl rockbas on the stori of stephen king the seri will intertwin charact and theme from the fiction town of castl rock a psychologicalhorror seri set in the stephen king multivers castl rock combin the mytholog scale and intim charact storytel of king bestlov work weav an epic saga of dark and light play out on a few squar mile of main woodland the fiction main town of castl rock ha figur promin in king literari career cujo the dark half it and need thing as well as novella the bodi and numer short stori such as rita hayworth and the shawshank redempt are either set there or contain refer to castl rock castl rock is an origin suspensethril a firstofitskind reimagin that explor the theme and world unit the entir king canon while brush up against some of hi most icon and belov stori,2018,7.7,,23744.0,60,"André Holland, Melanie Lynskey, Bill Skarsgård, Jane Levy"
389,389,timeless,action adventur drama,an unlik trio travel through time in order to battl unknown crimin and protect histori as we know itan unlik trio travel through time in order to battl unknown crimin and protect histori as we know it timeless tell the stori of a mysteri crimin who steal a secret stateoftheart time machin intent on destroy america as we know it by chang the past the onli hope is an unexpect team a scientist a soldier and a histori professor who must use the machin prototyp to travel back in time to critic event while they must make everi effort not to affect the past themselv they must also stay one step ahead of thi danger fugit but can thi handpick team uncov the mysteri behind it all and end hi destruct befor it too late,"2016, 2018",7.7,,30073.0,60,"Abigail Spencer, Matt Lanter, Malcolm Barrett, Paterson Joseph"
390,390,designated survivor,action drama mysteri,a lowlevel cabinet member becom presid of the unit state after a catastroph attack kill everyon abov him in the line of successiona lowlevel cabinet member becom presid of the unit state after a catastroph attack kill everyon abov him in the line of success kiefer sutherland star as tom kirkman a lowerlevel cabinet member who is suddenli appoint presid of the unit state after a catastroph attack on the us capitol dure the state of the union on the highli anticip seri design survivor in thi dramat thriller kirkman will struggl to keep the countri and hi own famili from fall apart while navig the highlyvolatil polit arena and while lead the search to find who is respons for the attack tom kirkman is a somewhat reluct politician in be appoint by us presid richmond to be a low level member of hi cabinet the appoint due to tom ideal in hi academ work that ideal ultim lead to a fall out between the two as tom is on the verg of be demot and is appoint design survivor for the next state of the union address at the capitol at which the rest of the cabinet will be in attend show their support tom is thrust into a fullfledg life of a politician when all the rest of the cabinet includ the presid are kill in a bomb attack dure that address leav tom to assum the presid take into account hi famili who did not sign up for such a polit life tom ha to decid what to do about hi and their futur and whether ideal ha ani place in the role of presid convers the public may have it own thought of tom as a nonelect presid especi if the immin demot ever come to light as time goe on tom thought about what to do may chang which becom all the more import when reelect time come around if he surviv that long in the posit in whether he and the public will want him to have a second full term all the while he ha to restor public confid in the aftermath of the bomb attack which requir a secret servic and fbi do their part to discov what happen,"2016, 2019",7.7,,56436.0,60,"Kiefer Sutherland, Adan Canto, Italia Ricci, Kal Penn"
