,Unnamed: 0.1,Title,Genre,Summary,Year,Rating,Metascore,Votes,Runtime,Actors
177,177,life,crime drama mysteri,a former polic offic return to the forc after have been wrongli imprison for yearsa team of scientist aboard the intern space station discov a rapidli evolv life form that caus extinct on mar and now threaten all life on earth six astronaut aboard the space station studi a sampl collect from mar that could provid evid for extraterrestri life on the red planet the crew determin that the sampl contain a larg singlecel organ the first exampl of life beyond earth butth arent alway what they seem as the crew begin to conduct research and their method end up have unintend consequ the life form prove more intellig than anyon ever expect life tell the stori of the sixmemb crew of the intern space station that is on the cut edg of one of the most import discoveri in human histori the first evid of extraterrestri life on mar as the crew begin to conduct research their method end up have unintend consequ and the life form prove more intellig than anyon ever expect a crew aboard the intern space station iss perform a success captur of a space probe return from mar with a sampl insid the crew is task with studi the sampl which may be the first proof of extraterrestri life howev the studi eventu backfir as the organ gain intellig trap aboard the iss with the rapidlygrow organ the crew must find out how to kill it befor it manag to escap and decim earth in near futur a group of intern scientist wa sent from earth to explor unknown mar at intern space station iss they got a soil sampl from mar which contain a sleep cell after a seri of attempt they woke up such cell and it wa grow bigger day by day dure an experi the live thing attack scientist and escap from the highli seal laboratori through an intern air vent those horrifi scientist on the one side they need to protect themselv from be kill by thi deadliest creatur on the other side they need to termin it befor it wa too late howev thi smart alien would do anyth to surviv in the near futur the unman pilgrim space probe return from mar to earth orbit with soil sampl potenti contain evid of extraterrestri life the probe is captur and it sampl retriev by the intern space station and it sixmemb crew exobiologist hugh derri who is paralyz from the waist down reviv a dormant cell from the sampl which quickli grow into a multicel organ that american school children name calvin hugh realiz that calvin cell can chang their special act as muscl sensor and neuron cell all at onc,2017,6.6,,180361.0,104,"Daniel Espinosa, Jake Gyllenhaal, Rebecca Ferguson, Ryan Reynolds, Hiroyuki Sanada"
178,178,eastbound & down,comedi drama sport,mani year after he turn hi back on hi hometown a burnedout major leagu ballplay return to teach physic educ at hi old middl schoolmani year after he turn hi back on hi hometown a burnedout major leagu ballplay return to teach physic educ at hi old middl school kenni power wa pois to rule the big leagu but two thing got in the way hi fade fastbal and hi insuffer person after a spectacular career flameout kenni goe home to shelbi counti nc to nurs hi wound and work as a gym teacher at hi old middl school,"2009, 2013",8.3,,47072.0,28,"Danny McBride, Steve Little, Katy Mixon, Elizabeth De Razzo"
179,179,metalocalypse,anim comedi music,the epic and overthetop adventur of dethklok the world most success death metal bandth epic and overthetop adventur of dethklok the world most success death metal band dethklok is the biggest baddest and most famou heavi metal band in the world the quintet consist of american nathan explos vocal william murderfac bass and pickl the drummer along with scandinavian guitarist toki wartooth and skwisgaar skwigelf have to deal with their fame and other situat in their live all the while be monitor by a govern organ out to destroy them,"2006, 2013",8.3,,14364.0,11,"Brendon Small, Tommy Blacha, Mark Hamill, Victor Brandt"
180,180,in treatment,drama,a psychotherapist question hi abil and get help by reunit with hi old therapist whom he ha not seen for ten yearsa psychotherapist question hi abil and get help by reunit with hi old therapist whom he ha not seen for ten year,"2008, 2010",8.3,,14332.0,25,"Gabriel Byrne, Dianne Wiest, Michelle Forbes, Blair Underwood"
181,181,studio 60 on the sunset strip,comedi drama,a behindthescen look at a fiction sketchcomedi televis showa behindthescen look at a fiction sketchcomedi televis show,"2006, 2007",8.3,,22089.0,44,"Matthew Perry, Amanda Peet, Bradley Whitford, Steven Weber"
182,182,how i met your mother,comedi romanc,a father recount to hi children through a seri of flashback the journey he and hi four best friend took lead up to him meet their mothera father recount to hi children through a seri of flashback the journey he and hi four best friend took lead up to him meet their mother ted mosbi sit down with hi kid to tell them the stori of how he met their mother the stori is told through memori of hi friend marshal lili robin and barney stinson all legendari season lead up to the moment of ted final encount with the one,"2005, 2014",8.3,,534995.0,22,"Josh Radnor, Jason Segel, Cobie Smulders, Neil Patrick Harris"
183,183,extras,comedi drama,andi millman is an actor with ambit and a script reduc to work as an extra with a useless agent andi attempt to boost hi career invari end in failur and embarrassmenta troubl child summon the courag to help a friendli alien escap earth and return to hi home world after a gentl alien becom strand on earth the be is discov and befriend by a young boy name elliott bring the extraterrestri into hi suburban california hous elliott introduc et as the alien is dub to hi brother and hi littl sister gerti and the children decid to keep it exist a secret soon howev et fall ill result in govern intervent and a dire situat for both elliott and the alien left behind by hi group of secret visitor a harmless extraterrestri entiti get strand on earth surround by an intimidatingli strang and unknown environ alon and fear the maroon be is fortun to be discov by the lone tenyearold boy elliott who after the initi shock decid to take him in and give him a nameet littl by littl a bond will formand as our hospit blue planet becom a prison brim with danger and govern agentselliott and hi team of rescuer must work fast to find a way to reunit the extraordinari intergalact guest with hi otherworldli famili even if thi mean elliott will lose an unexpect but dear friend while visit the earth at night a group of alien botanist is discov and disturb by an approach human task forc becaus of the more than hasti takeoff one of the visitor is left behind the littl alien find himself all alon on a veri strang planet fortun the extraterrestri soon find a friend and emot companion in yearold elliot a lone boy whose parent have separ while et slowli get acquaint with elliot older brother michael hi sister gerti and the custom of earth member of the task forc work day and night to track down the whereabout of earth first visitor from outer space the wish to go home again is strong in et and after be abl to commun with elliot and the other et start build an improvis devic to send a messag home for hi peopl to come and pick him up but befor long et get serious sick and becaus of hi special connect to elliot the young boy suffer too the situat get critic when the task forc final interven by then all help may alreadi be too late and there no alien spaceship in sight a group of alien visit earth and one of them is lost and left behind strand on thi planet the alien is found by a year old boy elliot soon the two begin to commun and start a differ kind of friendship in which et learn about life on earth and elliot learn about some new valu for the true mean of friendship et want to go home but if elliot help him hell lose a friend,1982,7.9,91.0,334452.0,115,"Steven Spielberg, Henry Thomas, Drew Barrymore, Peter Coyote, Dee Wallace"
184,184,mythbusters,documentari mysteri realitytv,a weekli documentari in which two hollywood special effect expert attempt to debunk urban legend by directli test thema weekli documentari in which two hollywood special effect expert attempt to debunk urban legend by directli test them mythbust take myth tall tale and urban legend and give them the scientif treatment to determin their valid myth are prove true probabl possibl improb or bust often after the realworld practic test have prove or debunk a myth the team will take the experi to the extrem mani time use more modern technolog than the myth could have use or up the black powder for impress explos,2003,8.3,,48615.0,44,"Robert Lee, Jamie Hyneman, Adam Savage, Kari Byron"
185,185,queer as folk,drama romanc,the live and love of a group of gay friend live in pittsburgh pennsylvaniait look like we dont have ani plot summari for thi titl yet be the first to contribut just click the edit page button at the bottom of the page or learn more in the plot summari submiss guid,2007,7.4,,30.0,88,"Tim King, Ant, Michelle Clunie, Ron Cowen, Robert Gant"
186,186,invader zim,anim action adventur,an alien name zim from the planet irk is sent on a secret mission to conquer earth not realis that hi leader were just tri to get rid of him and hope that he would die onc there zim manag to disguis himself as a human child but one boy name dib see through hi disguisean alien name zim from the planet irk is sent on a secret mission to conquer earth not realis that hi leader were just tri to get rid of him and hope that he would die onc there zim manag to disguis himself as a human child but one boy name dib see through hi disguis invad zim is an eccentr alien soldier from the planet irk he wa banish from the irken empir after nearli destroy hi home planet on an earli mission after beg hi superior the almighti tallest red and purpl for anoth chanc they decid to get rid of him onc and for all they trick him into go on a secret mission to an obscur planet at the edg of the univers a planet with the unlik name of earth their trick work and now zim is intent on bring down the human race he disguis himself as a schoolboy and now the onli person who can stop him is one kid dib membran a somewhat insan paranorm research who see straight through zim disguis and is intent on stop hi reign of terror but neither zim nor dib is veri good at their job and what result is everyth imagin from a giant hamster destroy the citi to both zim and dib be turn into bologna meat the univers greatest threat the irken empir is slowli take over the known univers through as it seem sheer dumb luck an irken invad exinvad actual zim who singlehandedli destroy an entir militari oper in hi past ha return to hi leader beg for anoth chanc to give himself a good name they do sort of actual they just send him on a joke mission to get him out of the way they pretend to see hi worth give him a junk robot and send him off hope hell die on the way to their surpris he live and actual find a planet to devast which iswhat a surpriseearth howev he ha land in the wrong place a paranorm investig dib ha seen through hi disguis and is hot on hi trail it sound like an averag alien stori but it aint did we mention dib is ten year old and consid stupid or crazi though clearli not by mani of hi peer and that zim isnt the best invad in the world or that neither of them is veri good at stop each other or that thi show will have you roll on the floor laugh if you can get your hand on the nicktoon channel or the dvd you may as well find out zim is an alien from the planet irk where social hierarchi is determin by how tall one is rather than ani type of skill or intellig sinc zim is one of the shortest peopl on irk and incompet to boot the almighti tallest send him on a fake mission to a planet which they dont think even exist and hope that he will die much to their surpris zim find a planet call earth and disguis himself as an ordinari human in order to gather inform about earth onli dib an aspir paranorm investig realiz that zim is an alien,"2001, 2004",8.3,,17628.0,24,"Andy Berman, Richard Steven Horvitz, Rikki Simons, Melissa Fahn"
187,187,courage the cowardly dog,anim adventur comedi,the offbeat adventur of courag a cowardli dog who must overcom hi own fear to heroic defend hi unknow farmer owner from all kind of danger paranorm event and menac that appear around their landth offbeat adventur of courag a cowardli dog who must overcom hi own fear to heroic defend hi unknow farmer owner from all kind of danger paranorm event and menac that appear around their land,"1999, 2002",8.3,,32645.0,11,"Marty Grabstein, Thea White, Peter Fernandez, Simon Prebble"
188,188,farscape,adventur drama scifi,thrown into a distant part of the univers an earth astronaut find himself part of a fugit alien starship crewwhen a fullscal war is engag by the evil scarran empir the peacekeep allianc ha but one hope reassembl human astronaut john crichton onc suck into the peacekeep galaxi through a wormhol crichton task get the entir peacekeep race to safeti befor the last war of an era bring and end to the univers fullscal galact war ha broken out between the coldblood peacekeep and the monstrou scarran the onli hope for the billion of innoc caught in the crossfir lie with john crichton and the crew of moya who tri to reviv the long dormant eidelon a race rumor to be abl to influenc peac in other,2004,8.2,,13849.0,182,"Raelee Hill, Melissa Jaffer, Paul Goddard, Tammy Macintosh"
189,189,the adventures of tintin,anim action adventur,the adventur of the young report hi faith dog and friend as they travel around the world on adventuresintrepid report tintin and captain haddock set off on a treasur hunt for a sunken ship command by haddock ancestor have bought a model ship the unicorn for a pound off a market stall tintin is initi puzzl that the sinist mr sakharin should be so eager to buy it from him resort to murder and kidnap tintin accompani by hi marvel dog snowi to join him and hi gang as they sail to morocco on an old cargo ship sakharin ha bribe the crew to revolt against the ship master drunken captain haddock but tintin snowi and haddock escap arriv in morocco at the court of a sheikh who also ha a model of the unicorn haddock tell tintin that over three hundr year earlier hi ancestor sir franci haddock wa forc to scuttl the origin unicorn when attack by a pirat forebear of sakharin but he manag to save hi treasur and provid clue to it locat in three separ scroll all of which were secret in model of the unicorn tintin and sakharin have one each and the villain intend to use the glassshatt top cs of operat soprano the milanes nightingal to secur the third with aid from bumbl interpol agent the thompson twin our boy hero hi dog and the captain must prevent sakharin from obtain all three scroll to fulfil the prophesi that onli the last of the haddock can discov the treasur whereabout,2011,7.3,68.0,201395.0,107,"Steven Spielberg, Jamie Bell, Andy Serkis, Daniel Craig, Simon Pegg"
190,190,spider-man: the animated series,anim action adventur,a young man with spiderlik abil fight crime as a superhero in new york citi while tri to have a normal person lifea young man with spiderlik abil fight crime as a superhero in new york citi while tri to have a normal person life after be bitten by a radioact spider young peter parker find that he now ha spiderlik super power hope to use hi newfound abiilti for wealth and fame he let hi ego blind him to the need of other and indirectli caus the death of hi uncl ben when he refus to help a polic offic catch a flee crimin humbl by hi failur he resolv to use hi talent for fight crime and becom the superhero spiderman while he fight assort supervillain peter also must balanc hi person life includ hi girlfriend mari jane hi job as a photograph at the daili bugl and a an editor who ha convinc himself that spiderman is a crimin that ha to be brought down,"1994, 1998",8.3,,22732.0,23,"Christopher Daniel Barnes, Sara Ballantine, Edward Asner, Roscoe Lee Browne"
191,191,babylon 5,action adventur drama,in the mid rd centuri the earth allianc space station babylon locat in neutral territori is a major focal point for polit intrigu racial tension and variou war over the cours of five yearsin the mid rd centuri the earth allianc space station babylon locat in neutral territori is a major focal point for polit intrigu racial tension and variou war over the cours of five year in the year it is ten year after the earthminbari war command sinclair take command of a giant fivemilelong cylindr space station orbit a planet in neutral space at a crossroad of interstellar commerc and diplomaci cmdr sinclair d season captain sheridan must tri to establish peac and prosper between variou interstellar empir all the while fight forc from within the earth allianc it is a precari command particularli given that sabotag led to the destruct of babylon station and and vanish without trace,"1994, 1998",8.3,,25815.0,45,"Mira Furlan, Richard Biggs, Stephen Furst, Andreas Katsulas"
192,192,northern exposure,comedi drama fantasi,a newli graduat doctor is requir to set up hi practic in an eccentr alaskan towna newli graduat doctor is requir to set up hi practic in an eccentr alaskan town joel fleishman is fresh out of medic colleg and fresh out of luck fail to read the fine print in hi scholarship condit he find he ha no choic but to move to the remot and somewhat eccentr town of cice in the wild of alaska onc there he is welcom by the peculiar local who are not keen to see him go most especi mauric minnifield the exnasa astronaut despit joel adam denial one get the impress that he enjoy life in cice more than he admit joel fleischman is a nebbishi jewish doctor from new york citi and a fresh face medic school graduat he also about to begin the four year servic contract he promis to the state of alaska who financ hi educ but he just happen to forget read some of the stipul in hi contract that ha assign him to the small post of cice alaska a town of peopl that welcom it newest resid with open arm as he contend with the daili live and ritual of these all too normal and trust folk joel just might realiz that cice quieter way are probabl more civil than the hustl and bustl of manhattan made up of cice variou resid patient and friend of fleischman includ wealthi former astronaut mauric minnifield feisti pilot maggi oconnel mayor and saloon owner holl vincoeur hi sweet naiv waitress girlfriend shelli tambo who old enough to be hi daughter intellectu excon and disc jockey chri steven joel far wiser and veri quiet receptionist marilyn whirlwind kindli store owner ruthann miller and avid film buff ed chigliak,"1990, 1995",8.3,,13760.0,60,"Rob Morrow, Janine Turner, Barry Corbin, John Cullum"
193,193,the wonder years,comedi drama famili,kevin arnold recal grow up dure the late s and earli s the turbul social time make the transit from child to adult unusu interestingkevin arnold recal grow up dure the late s and earli s the turbul social time make the transit from child to adult unusu interest the seri depict the social and famili life of a boy in a typic american suburban middleclass famili from to cover the age of through each year in the seri take place exactli year befor air to the show plot center on kevin arnold son of jack and norma arnold kevin father hold a manag job at norcom a defens contractor while hi mother is a housewif kevin also ha an older brother wayn and an older sister karen two of kevin friend and neighbor are promin featur throughout the seri hi best friend paul pfeiffer and hi crushturnedgirlfriend gwendolyn winni cooper storylin are told through kevin reflect as an adult in hi mid s an adult kevin arnold reminisc on hi teenag year spent grow up dure the late s and earli s as he goe from adolesc to adulthood he experi along with hi best friend paul and sometimesgirlfriend winni the full rang of trial and trauma that come in just about everyon life thi period dramedi take place dure the turbul time of the late s and s the show focus on kevin arnold a young teenag live in a quiet middleclass suburb and hi famili and friend throughout the seri fiveyear run kevin deal with middl and high school encount puberti ha up and down with childhood sweetheart winni cooper deal with annoy older brother wayn and hang out with geekybutlov paul the seri is told from kevin pointofview,"1988, 1993",8.3,,31664.0,22,"Fred Savage, Dan Lauria, Daniel Stern, Alley Mills"
194,194,all in the family,comedi drama,a work class man constantli squabbl with hi famili over the import issu of the daya work class man constantli squabbl with hi famili over the import issu of the day archi bunker wa a bigot workingclass famili man who held hi view of the world hi viewpoint clash with nearli everyon he come into contact with especi hi soninlaw mike stivic or as archi delight in call him meathead,"1971, 1979",8.3,,12512.0,30,"Carroll O'Connor, Jean Stapleton, Rob Reiner, Sally Struthers"
195,195,star trek,action adventur scifi,in the rd centuri captain jame t kirk and the crew of the uss enterpris explor the galaxi and defend the unit feder of planetsten year befor kirk spock and the enterpris the uss discoveri discov new world and lifeform as one starfleet offic learn to understand all thing alien,2017,7.4,,67099.0,60,"Sonequa Martin-Green, Doug Jones, Anthony Rapp, Mary Wiseman"
196,196,the andy griffith show,comedi famili,widow sheriff andi taylor and hi son opi live with andi aunt bee in mayberri north carolina with virtual no crime to solv most of andi time is spent philosoph and calm down hi cousin deputi barney fifewidow sheriff andi taylor and hi son opi live with andi aunt bee in mayberri north carolina with virtual no crime to solv most of andi time is spent philosoph and calm down hi cousin deputi barney fife,"1960, 1968",8.3,,10554.0,30,"Andy Griffith, Ron Howard, Don Knotts, Frances Bavier"
197,197,i love lucy,comedi famili,a daffi woman constantli strive to becom a star along with her bandlead husband and get herself in the strangest situationsa daffi woman constantli strive to becom a star along with her bandlead husband and get herself in the strangest situat cuban bandlead ricki ricardo would be happi if hi wife luci would just be a housewif instead she tri constantli to perform at the tropicana where he work and make life comic frantic in the apart build they share with landlord fred and ethel mertz the first major show to be put on film rather than kinescop,"1951, 1957",8.3,,20520.0,30,"Lucille Ball, Desi Arnaz, Vivian Vance, William Frawley"
198,198,the kominsky method,comedi,an age actor who long ago enjoy a brush with fame make hi live as an act coachan age actor who long ago enjoy a brush with fame make hi live as an act coach michael dougla play an actor who made it big a long time ago and who now is an act coach at hi studio name after himself the kominski method hi best friend and agent lose hi wife to cancer which leav both of them question their exist as they struggl through choic and relationship old and new as kominski teach a class to actor he meet a woman whom he ha deep feel for but lack the skill to make a relationship work meanwhil hi agent struggl with the pain of hi wife death and a drug addict daughter throughout the seri it becom clear that their advanc age ha challeng that neither one know how to overcom and as they keep onboard thi train of life which is closer to death then ever befor they learn to navig their way through pain and charact growth and set back,2018,8.2,,11130.0,30,"Michael Douglas, Alan Arkin, Sarah Baker, Graham Rogers"
199,199,american vandal,comedi crime drama,a truecrim satir that explor the aftermath of a costli high school prank that left twentyseven faculti car vandal with phallic imagesa truecrim satir that explor the aftermath of a costli high school prank that left twentyseven faculti car vandal with phallic imag clearli a riff on the stream giant acclaim true crime seri make a murder and the keeper american vandal is a halfhour true crime satir that explor the aftermath of a costli high school prank that left twentyseven faculti car vandal with phallic imag over the cours of the eightepisod season an aspir sophomor documentarian peter maldanaldo investig the controversi and potenti unjust expuls of dylan maxwel the troubl senior accus of the phallic vandal,"2017, 2018",8.2,,22133.0,34,"Tyler Alvarez, Griffin Gluck, Jimmy Tatro, Travis Tope"
