,Unnamed: 0.1,Title,Genre,Summary,Year,Rating,Metascore,Votes,Runtime,Actors
555,555,american dad!,anim comedi,the random escapad of stan smith a conserv cia agent deal with famili life and keep america safe all in the most absurd way possibleth random escapad of stan smith a conserv cia agent deal with famili life and keep america safe all in the most absurd way possibl stan smith who work for the cia and is constantli on the alert for terrorist activ will go to extrem to protect hi belov america from harm as evidenc by the terroralert color code on hi fridg and hi frequent kneejerk reaction of shoot hole in the toaster whenev the toast pop up in addit to stan wife and teenag children the smith household ha two rather unconvent member there roger the sarcast space alien who rescu stan from area who deepli resent the fact that he not allow to leav the hous and therefor ha been reduc to drink wine and smoke cigarett and klau a lascivi germanspeak goldfish the result of a cia experi gone serious wrong where the cia tri to give a fish a german man brain stan son is a dorki teenag who tri to be cool hi wife ha had a past life of sex and drug the misadventur of stan smith and hi wacki famili stan work for the cia and is constantli on the lookout for terrorist he love hi famili and will do anyth to protect them and hi countri francin stan wife she ha had a past life of drug but ha care hidden her partygirl person for the sake of the conserv man she love she met stan after colleg hayley the teenag daughter of the famili current attend commun colleg despit her father best effort she ha turn out to be a leftw liber stan love hi daughter but that doesnt necessarili mean he trust her steve the dorki son he tri to act cool but fail steve is on the verg of puberti but he just cant quit make it hi low social statu sometim lead him to take drastic action but no matter what he doe he still just a dork roger a sarcast alien rescu by stan from area he resent not be allow to leav the hous so he resort to drink wine and smoke cigarett klau a germanspeak goldfish he wa a cia experi that went horribl wrong when they tri transplant a german man brain into a goldfish klau lust after francin and will take ani opportun that come hi way,2005,7.4,,105634.0,22,"Seth MacFarlane, Wendy Schaal, Scott Grimes, Rachael MacFarlane"
556,556,the 4400,scifi drama mysteri,as the reappear of miss person on a singl day confound the global commun feder agent on the case slowli discov the way in which the victim have been changeda the reappear of miss person on a singl day confound the global commun feder agent on the case slowli discov the way in which the victim have been chang the explor the travail of the peopl who all at onc return in a ball of light to earth though the returne had not age physic mani of them reappear with dramat abil rang from enhanc reflex to precognit ntac nation threat assess command is the govern agenc respons for keep track of the returne and investig all thing relat to the the pilot begin with a ball of light sail toward earth but rather than the expect catastroph event thousand of return abducte are left with no memori of their otherworldli experi each ha been gone anywher from a few month to sever decad but hasnt age a day these are the stori of the abducte after they are return to earth the show follow two nsa agent who are tri to figur out what happen and whi some of those return have been affect in mysteri way with certain abil both good and bad,"2004, 2007",7.4,,40170.0,43,"Jacqueline McKenzie, Joel Gretsch, Patrick John Flueger, Conchita Campbell"
557,557,law & order: criminal intent,crime drama mysteri,thi third law and order seri involv the crimin justic system from the crimin point of viewth special victim unit a special train squad of detect in the nypd investig sexual relat crime in the crimin justic system sexual base offens are consid especi heinou in new york citi the dedic detect who investig these viciou feloni are member of an elit squad known as the special victim unit these are their stori thi show delv into the dark side of the new york underworld as the detect of a new elit forc the special victim unit investig and prosecut variou sexual orient crime while tri to balanc the effect of the investig on their own live,1999,8.0,,68069.0,60,"Mariska Hargitay, Christopher Meloni, Ice-T, Dann Florek"
558,558,jackie chan adventures,anim action adventur,jacki chan and hi extend famili must fight a crimin organ for magic talisman that could releas an evil spiritjacki chan and hi extend famili must fight a crimin organ for magic talisman that could releas an evil spirit jacki chan an amateur archelogist would prefer to quietli do hi work for the local univers but fate ha dealt anoth hand that happen when he find a shield contain a talisman is but the first of a dozen pursu by a crimin organ call the dark hand led a man call valmont and guid by a spirit call shendu against thi jacki hi niec jade and their uncl must cooper with the secret law enforc organ section to oppos thi threat along the way our hero must face wild danger that will demand all of jacki skill in martial art and hi dare to overcom,"2000, 2005",7.4,,16327.0,30,"Jackie Chan, James Sie, Stacie Chan, Sab Shimono"
559,559,clerks,anim comedi,the continu adventur of clerk dant and randal who tri to make the best of their menial labor with no help from jay and silent boba day in the live of two conveni clerk name dant and randal as they annoy custom discuss movi and play hockey on the store roof dant hick is not have a good day he work as a clerk in a small conveni store and is told to come into work on hi day off dant think life is a seri of down end and thi day is prove to no differ he read in the newspap that hi exgirlfriend caitlin is get marri hi present girlfriend reveal to have somewhat more experi with sex that he ever imagin hi princip concern are the hockey game he ha that afternoon and the wake for a friend who die hi buddi randal grave work as a clerk in the video store next and he hate hi job just about as much as dant hate hi dant hick is a clerk at a local conveni store in new jersey on one particular saturday morn he get call in on hi day off onc there he must deal with multipl problem the shutter outsid wont open hi exgirlfriend whom he is still in love with is get marri hi girlfriend who bug him about start colleg ha reveal certain uhstuff about her past hi boss hasnt come in to take hi place he ha a hockey game at oclock anoth ex ha die and today the last day he can go to her wake he must deal with custom that arent so intellig hi friend randal a clerk at the video store next door is even less dedic to hi job than dant and is alway bother dant custom and the biggest problem of them all he not even suppos to be there today can dant manag it all it just anoth day for dant hick until hi boss call him into work at the quickstop on hi day off with a hockey game at and hi girlfriend still hack him about go to back to school dant begin to get into a bigger frenzi when he learn hi exgirlfriend caitlin is get marri with hi alway late accomplic randal stroll in to work at the video store dant is left with no choic but to bend the rule a littl with work custom and most of all hi love life can he get away with it all dant ha had a crummi job at an small conveni store sinc graduat from high school three year ago while still enamor of hi high school sweetheart caitlin he now ha a seriou relationship with longsuff veronica who want him to quit hi job and begin colleg hi best friend randal who run the nextdoor video store is even less dedic to hi job than dant the movi cover one event day at the job the movi describ a day in the life of two clerk in new jersey dant hick call to work in hi day off and hi daili problem start hi girlfriend want to leav him hi friend randal a clerk of a video store next to him make him asham constantli in front of hi custom hi exgirlfriend get marri he need to go to a hockey game in the noon and none can replac him he ha to go to a friend wake he ha to deal with annoy custom a pair of drug dealer outsid hi store annoy him etc,1994,7.8,70.0,200622.0,92,"Kevin Smith, Brian O'Halloran, Jeff Anderson, Marilyn Ghigliotti, Lisa Spoonauer"
560,560,dark angel,action drama mysteri,a group of geneticallyenhanc children escap from a lab project year later we meet max one of the escape who now work for a messeng servic in the postapocalypt pacif northwesta group of geneticallyenhanc children escap from a lab project year later we meet max one of the escape who now work for a messeng servic in the postapocalypt pacif northwest in a futur of polit econom and moral collaps a genet enhanc superhuman prototyp name max escap from militari confin and dwell amidst the decad underground street life of seattl to avoid govern agent who want to bring her back into the fold search for other of her kind who were scatter in the aftermath of her escap max encount logan an idealist cyberjournalist battl repress and corrupt in postapocalyps america eventu logan call her to the highest part of her be and max becom hi samurai as the pair take on the ruthless powerbrok of the new millennium max and logan odyssey lead them closer to the secret of her past deepen and complic their relationship in the process,"2000, 2002",7.4,,28712.0,60,"Jessica Alba, Michael Weatherly, Richard Gunn, J.C. MacKenzie"
561,561,arthur,anim comedi drama,base on the book by marc brown these are the adventur of arthur an yearold aardvark and hi famili and friend as they grow up and learn how to be good neighbor to one anotherrob of hi birthright arthur come up the hard way in the back alley of the citi but onc he pull the sword from the stone he is forc to acknowledg hi true legaci whether he like it or not an altern version of the king arthur legend as a boy arthur is left orphan after hi father king uther pendragon and mother are kill in a war wage against them by vortigern who then assum the throne arthur flee and is rais in a brothel know veri littl of hi birthright vortigern want arthur dead to ensur there is no claimant to the throne the legend foretel that onli the next king will be abl to draw excalibur uther sword from the rock where it is lodg so in an effort to identifi arthur vortigern forc all the young men of arthur age to attempt to draw out the sword now it is arthur turn mordr an ironfist warlock and hi armi lay sieg to camelot seek to establish the domin of magicwield mage over humankind uther pendragon king of the briton infiltr mordr lair and behead him save camelot uther treacher younger brother vortigern who covet the throne orchestr a coup and sacrific hi wife elsa to moat hag to becom a demon knight who kill uther wife igrain and slay uther in combat the onli survivor is uther son arthur who drift away in a boat and end up in londinium,2017,6.8,,166374.0,126,"Guy Ritchie, Charlie Hunnam, Astrid Bergès-Frisbey, Jude Law, Djimon Hounsou"
562,562,"two guys, a girl and a pizza place",comedi romanc,three twentysometh share a boston apart and hang around and work at a pizza placethre twentysometh share a boston apart and hang around and work at a pizza place the live and love of three close friend pete a neurot architectur student berg the laidback preme and sharon a tough girl with a soft center pete and berg are roommat and student at a local boston univers while sharon struggl with her work and relationship,"1998, 2001",7.4,,14717.0,30,"Traylor Howard, Ryan Reynolds, Richard Ruccolo, Suzanne Cryer"
563,563,sliders,adventur fantasi scifi,a boy geniu and hi comrad travel to differ parallel univers tri to find their way back homea boy geniu and hi comrad travel to differ parallel univers tri to find their way back home quinn mallori while work on an antigrav machin accident creat a portal to a parallel univers eventu hi friend and an unwil particip accident get stuck travel among parallel world tri to surviv and learn that slide can lead to fatal result meanwhil among mani chang in their group they tri to rescu the multivers from the kromagg dynasti while tri to develop an antigrav devic physic geniu quinn mallori instead creat a devic that open portal to altern realiti after an accid leav them lost mallori and hi companion hi physic professor professor maximillian arturo hi work colleagu and potenti love wade well and a washedup soul singer rembrandt brown slide from realiti to realiti in search of home,"1995, 2000",7.4,,14896.0,60,"Jerry O'Connell, Sabrina Lloyd, John Rhys-Davies, Cleavant Derricks"
564,564,alf,comedi famili scifi,a furri alien wiseguy come to live with the tanner famili after crash into their garagea furri alien wiseguy come to live with the tanner famili after crash into their garag the tanner famili is an averag american famili one day they discov that they have a visitor he small he furri he arrog and he an alien from the planet melmac unsur what to do they name him alf alien life form alf soon decid that as much as he miss hi home planet there a lot to be said for earth the tanner are will to conced anyth as long as he doesnt announc hi presenc oh yeah the tanner also have a cat which look rather tasti,"1986, 1990",7.4,,28285.0,30,"Mihaly 'Michu' Meszaros, Paul Fusco, Max Wright, Anne Schedeen"
565,565,the cosby show,comedi famili romanc,the goingson in the life of a success africanamerican familyth goingson in the life of a success africanamerican famili the cosbi show center on the live of the huxtabl obstetrician cliff and hi lawyer wife clair their daughter sondra denis vanessa and rudi and son theo base on the standup comedi of bill cosbi the show focus on hi observ of famili life although base on comedi the seri also address some more seriou topic such as learn disabl and teen pregnanc longrun popular comedi televis seri about the huxtabl famili doctor heathcliff huxtabl and clair huxtabl a happili marri coupl are rais their children sondra denis theodor vanessa and rudi the two oldest daughter eventu live success adult live and get marri sondra to elvin and denis to martin as the children get older the famili get larger and to the chagrin of cliff keep on come back home when he want them to move out and live on their own for good,"1984, 1992",7.4,,28885.0,30,"Bill Cosby, Phylicia Rashad, Keshia Knight Pulliam, Malcolm-Jamal Warner"
566,566,little house on the prairie,drama famili romanc,the life and adventur of the ingal famili in the nineteenth centuri american midwestth life and adventur of the ingal famili in the nineteenth centuri american midwest a longrun drama base upon the littl hous seri of book by laura ingal wilder littl hous on the prairi follow the live of the simpl farm ingal famili charl carolin mari laura carri and then grace and the later adopt albert jame and cassandra who settl into a quaint littl hous on the bank of plum creek near the small town of walnut grove dure the late s often narrat by laura the seri follow her simpl farm upbring from her childhood until her adulthood with almanzo wilder with whom she start a famili of her own while the seri is base upon the littl hous book and thu the real life of author laura ingal wilder it is a veri loos adapt with mostli onli key event and element of fact surviv the transit from book to tv seri the most import be mari eventu blind and laura futur sever other fictiti some factual charact make up the friendli commun of walnut grove includ teacher miss beadl succeed by two other teacher then laura then etta plum dr hiram baker rev robert alden mr hanson of the hanson lumber mill and the welltodo oleson owner of the local mercantil and also the primari rival of the ingal famili except the oleson patriarch famili friend includ the edward famili the garvey famili and the carter who in the final season move into the ingal littl hous,"1974, 1983",7.4,,14432.0,60,"Melissa Gilbert, Michael Landon, Karen Grassle, Rachel Lindsay Greenbush"
567,567,gilligan's island,comedi famili,seven men and women are strand on an unchart island follow a torrenti stormseven men and women are strand on an unchart island follow a torrenti storm dure what wa suppos to be a threehour tour the ss minnow is shipwreck on an unchart tropic island follow a typhoon the seven castaway includ the minnow blusteri captain hi bumbl first mate gilligan a millionair coupl name the howel curvac movi star ginger grant sexi farm girl mari ann summer and a scienc professor known as the professor despit their dire situat the castaway manag to surviv on a diet made up of fish and coconut cream pie and were aid by their trusti transistor radio and a seemingli neverend parad of guest star who manag to drop by their desert island includ a big game hunter a movi produc a mad scientist a rock band russian cosmonaut foreign spi and a jungl boy yet never manag to bring the castaway to safeti in hawaii gilligan and the skipper are give out tour five passeng a movi star from hollywood a gener store sale clerk from kansa a professor and two millionair board the ss minnow for three hour tour a storm come in and the crew are unabl to handl the boat the castaway wake up on a desert island they live in hut made from stick and leav they eat plant and fruit found in the island they will encount mani adventur while tri to make it back to civil,"1964, 1992",7.4,,11116.0,30,"Bob Denver, Alan Hale Jr., Jim Backus, Natalie Schafer"
568,568,scream: the tv series,crime drama horror,a serial antholog seri that follow a group of teenag be target by a mask serial killera serial antholog seri that follow a group of teenag be target by a mask serial killer after a cyberbulli incid result in a brutal murder the shock violenc stir up memori of a kill spree from the past that ha haunt some intrigu other and mayb just inspir a new killer a group of teen with two old friend struggl to reconnect at it heart becom lover enemi suspect target and victim of an assassin who out for blood a popular yet intellectu teenag girl start to question whether or not she is a good person as her classmat are target by a techsavvi serial killer her friend are all lie and keep secret from her and she not left with mani other to trust as she realiz her mother shadi past is somehow connect to the new cyberstalk she start bud up with her exbest friend to get some answer but that also mean she go to face off against a killer who out for blood where the whole seri begin with a cyber bulli act it end with someth total differ than some video in lakewood peopl are be brutal murder and harass the killer is someon no one would ever suspect there are lie apolog friendship and heartbreak there are clue to a mysteri that need to be solv all surround a mass murder from the past brandon jame wa that murder but he dead so who could it be with the outbreak of a inappropri video a death occur spark memori of a seri of murder earlier on as the rumour of a serial killer spread so doe the bodycount friend and love one becom victim or suspect all lead to the final scream the tv seri is base on the eponym intern hit horror franchis after a cyberbulli incid result in a brutal murder the shock violenc stir up memori of a kill spree from the past that ha haunt some intrigu other and mayb just inspir a new killer a group of teen with two old friend struggl to reconnect at it heart becom lover enemi suspect target and victim of a killer who out for blood,2015,7.3,,29341.0,45,"Willa Fitzgerald, Bex Taylor-Klaus, John Karna, Carlson Young"
569,569,the librarians,action adventur comedi,a group of librarian set off on adventur in an effort to save mysteri ancient artifactsa group of librarian set off on adventur in an effort to save mysteri ancient artifact the librari ha chosen a new group to help safeguard magic curs artifact throughout time and around the world an art historian a thief a mathematician and a warrior are sent through the doorway to help bring back the other who are protect by the librari from the evil recent releas,"2014, 2018",7.3,,17254.0,42,"Rebecca Romijn, Christian Kane, Lindy Booth, John Harlan Kim"
570,570,emerald city,adventur drama fantasi,a modern reimagin of the stori that led to the wizard of oza modern reimagin of the stori that led to the wizard of oz when a tornado transport dorothi gale from luca kan to the faraway land of oz her arriv set in motion a propheci about a disastr event known as the beast forev and strike fear into the land almighti ruler the wizard on her quest to meet the wizard in emerald citi dorothi encount witch an amnesiac soldier a shelter littl boy and mani more mysteri be who will ultim shape the futur of oz and dorothi place in it gritti retel of dorothi travel to oz dorothi is brought to kansa dure a tornado as a babi and she bear a mysteri mark on her hand jump year later while work as a nurs she also need med we see her take what she need and that night a tornado sweep through luca kansa while tri to find the peopl dorothi live she hear siren and start yell for help onc found the offic pull a weapon think the wors in a swift second the policemen is pick up by the funnel cloud with dorothi jump into the polic car unknown the unit is a k unit and is suck into the vortex come to oz land on the witch of the east get out of the polic car she find there is a german shepard in the back she gather what she can and name the dog toto what will happen will dorothi find out where she is will anyon help her,"2016, 2017",7.3,,10597.0,60,"Adria Arjona, Oliver Jackson-Cohen, Ana Ularu, Gerran Howell"
571,571,the tomorrow people,action drama scifi,evolv human with amaz abil teleport telekinesi telepathi are be hunt down by agent of ultraevolv human with amaz abil teleport telekinesi telepathi are be hunt down by agent of ultra the stori of sever young peopl from around the world who repres the next stage in human evolut possess special power includ the abil to teleport and commun with each other telepath togeth they work to defeat the forc of evil stephen jameson think that he go insan but find out that he ha the abil to move thing with hi mind read peopl thought and teleport from place to place but stephen find out that he not the onli one that ha these these peopl call themselv the tomorrow peopl a new step in human evolut be hunt down by ultra a secret organ that hunt thi speci there a shadow war go on but who will come on top the human or the tommorow peopl they are the next evolutionari leap of mankind a gener of human born with paranorm abil the tomorrow peopl stephen jameson stand at the crossroad between the world we know and the shift world of the futur up until a year ago stephen wa a normal teenag until he began hear voic and teleport in hi sleep never know where he might wake up now stephen issu have gone far beyond the usual teenag angst and he is begin to question hi saniti in desper stephen decid to listen to one of the voic in hi head and it lead him to hi first encount with the tomorrow peopl john cara and russel a genet advanc race with the abil of telekinesi teleport and telepath commun the tomorrow peopl are be hunt down by a paramilitari group of scientist known as ultra led by dr jedikiah price ultra see the tomorrow peopl as a veri real existenti threat from a rival speci and the outcast group ha been forc to hide out in an abandon subway station just beneath the surfac of the human world trade in secret jedikiah offer stephen the chanc for a normal life with hi famili and best friend astrid if he will help in the struggl to isol and erad the tomorrow peopl on the other hand cara john and russel offer stephen a differ type of famili and a home where he truli belong unwil to turn hi back on human or the world of the tomorrow peopl stephen set out on hi own path a journey that could take him into the shadowi past to uncov the truth about hi father mysteri disappear or into an unknown futur with the tomorrow peopl,"2013, 2014",7.3,,32467.0,43,"Robbie Amell, Peyton List, Luke Mitchell, Aaron Yoo"
572,572,brickleberry,anim comedi,a group of neverdowel forest ranger are face the shutdown of their nation park when a new ranger arriv to help transform them and save the parka group of neverdowel forest ranger are face the shutdown of their nation park when a new ranger arriv to help transform them and save the park,"2012, 2015",7.3,,11343.0,22,"Daniel Tosh, Roger Black, David Herman, Tom Kenny"
573,573,don't trust the b---- in apartment 23,comedi,chloe is a new york parti girl with the moral of a pirat she caus troubl for her naiv small town roommat june and chloe best friend jame van der beekchlo is a new york parti girl with the moral of a pirat she caus troubl for her naiv small town roommat june and chloe best friend jame van der beek june move to new york citi to pursu her dream job at a mortgag compani which come with it own apart howev the compani is shut down on her first day and the apart is taken away june move in with chloe who is a conartist and allround parti girl at first they dont get along when chloe attempt to con june backfir they end up becom friend,"2012, 2013",7.3,,31621.0,22,"Krysten Ritter, Dreama Walker, Michael Blaiklock, Eric André"
574,574,girls,comedi drama,a comedi about the experi of a group of girl in their earli sthree suburban mother suddenli find themselv in desper circumst and decid to stop play it safe and risk everyth to take their power back,2018,7.9,,13570.0,43,"Christina Hendricks, Retta, Mae Whitman, Reno Wilson"
575,575,breakout kings,crime drama thriller,a squad of us marshal team up with con former fugit to work togeth on track down prison escape in exchang for get time off their sentencesa squad of us marshal team up with con former fugit to work togeth on track down prison escape in exchang for get time off their sentenc,"2011, 2012",7.3,,14137.0,43,"Domenick Lombardozzi, Brooke Nevin, Malcolm Goodwin, Jimmi Simpson"
